{
  "$schema": "/schemas/svg-asset-registry.schema.json",
  "id": "aptlantis-studio-svg-asset-registry",
  "title": "Aptlantis Studio SVG Asset Registry",
  "version": "0.1.0",
  "lastUpdated": "2026-07-15",
  "assets": [
    {
      "type": "asset",
      "asset_type": "svg",
      "slug": "aptlantis-about-hero-logo",
      "title": "Aptlantis About Hero Logo",
      "source": {
        "format": "svg",
        "path": "/logos/aptlantis-about-hero-logo.svg",
        "publicUrl": "/logos/aptlantis-about-hero-logo.svg",
        "content_hash": "sha256:8d80cb0f7e57ab065c457f2a2433bacd258dee7bc47568dddf82fcdece93a2c0"
      },
      "sesm": {
        "accessibility": {
          "summary": "Aptlantis About Hero Logo"
        },
        "asset": {
          "ecosystem": "Aptlantis Studio",
          "id": "aptlantis-about-hero-logo",
          "role": "branding",
          "tags": ["branding", "illustration"],
          "title": "Aptlantis About Hero Logo"
        },
        "provenance": {
          "author": "Aptlantis",
          "generated": false,
          "generated_at": "1784133488",
          "generator": {
            "language": "rust",
            "name": "aptlantis-svg-asset-registry",
            "version": "0.1.0"
          },
          "license": "Site content license pending",
          "source": "/logos/aptlantis-about-hero-logo.svg"
        },
        "sesm_version": "0.3.0"
      },
      "dimensions": {
        "width": "1448",
        "height": "1086",
        "viewBox": "0 0 1448 1086"
      },
      "roles": ["branding", "illustration"]
    },
    {
      "type": "asset",
      "asset_type": "svg",
      "slug": "aptlantis-contact-hero-logo",
      "title": "Aptlantis Contact Hero Logo",
      "source": {
        "format": "svg",
        "path": "/logos/aptlantis-contact-hero-logo.svg",
        "publicUrl": "/logos/aptlantis-contact-hero-logo.svg",
        "content_hash": "sha256:d6770e4212640a2e17ad496ac49ab7397c150d6b075ac8f7201130fa01451484"
      },
      "sesm": {
        "accessibility": {
          "summary": "Aptlantis Contact Hero Logo"
        },
        "asset": {
          "ecosystem": "Aptlantis Studio",
          "id": "aptlantis-contact-hero-logo",
          "role": "branding",
          "tags": ["branding", "illustration"],
          "title": "Aptlantis Contact Hero Logo"
        },
        "provenance": {
          "author": "Aptlantis",
          "generated": false,
          "generated_at": "1784133488",
          "generator": {
            "language": "rust",
            "name": "aptlantis-svg-asset-registry",
            "version": "0.1.0"
          },
          "license": "Site content license pending",
          "source": "/logos/aptlantis-contact-hero-logo.svg"
        },
        "sesm_version": "0.3.0"
      },
      "dimensions": {
        "width": "1448",
        "height": "1086",
        "viewBox": "0 0 1448 1086"
      },
      "roles": ["branding", "illustration"]
    },
    {
      "type": "asset",
      "asset_type": "svg",
      "slug": "aptlantis-hero-logo",
      "title": "Aptlantis Hero Logo",
      "source": {
        "format": "svg",
        "path": "/logos/aptlantis-hero-logo.svg",
        "publicUrl": "/logos/aptlantis-hero-logo.svg",
        "content_hash": "sha256:30f14fa5e3d26ad85234607f2ccf2205218ff61c4108929f80ddb1287e1a1ba5"
      },
      "sesm": {
        "accessibility": {
          "summary": "Aptlantis Hero Logo"
        },
        "asset": {
          "ecosystem": "Aptlantis Studio",
          "id": "aptlantis-hero-logo",
          "role": "logo",
          "tags": ["logo", "branding", "illustration"],
          "title": "Aptlantis Hero Logo"
        },
        "provenance": {
          "author": "Aptlantis",
          "generated": false,
          "generated_at": "1784133488",
          "generator": {
            "language": "rust",
            "name": "aptlantis-svg-asset-registry",
            "version": "0.1.0"
          },
          "license": "Site content license pending",
          "source": "/logos/aptlantis-hero-logo.svg"
        },
        "sesm_version": "0.3.0"
      },
      "dimensions": {
        "width": "1448",
        "height": "1086",
        "viewBox": "0 0 1448 1086"
      },
      "roles": ["logo", "branding", "illustration"],
      "debug": {
        "imported_at": "1784132581",
        "imported_by": "aptlantis-services/svg-assets-scan"
      }
    },
    {
      "type": "asset",
      "asset_type": "svg",
      "slug": "aptlantis-privacy-hero-logo",
      "title": "Aptlantis Privacy Hero Logo",
      "source": {
        "format": "svg",
        "path": "/logos/aptlantis-privacy-hero-logo.svg",
        "publicUrl": "/logos/aptlantis-privacy-hero-logo.svg",
        "content_hash": "sha256:3b421aaaccbf4e72d95abe5bc84d744bf57d30cdca29ba89b5c44638b61cd9cc"
      },
      "sesm": {
        "accessibility": {
          "summary": "Aptlantis Privacy Hero Logo"
        },
        "asset": {
          "ecosystem": "Aptlantis Studio",
          "id": "aptlantis-privacy-hero-logo",
          "role": "branding",
          "tags": ["branding", "illustration"],
          "title": "Aptlantis Privacy Hero Logo"
        },
        "provenance": {
          "author": "Aptlantis",
          "generated": false,
          "generated_at": "1784133488",
          "generator": {
            "language": "rust",
            "name": "aptlantis-svg-asset-registry",
            "version": "0.1.0"
          },
          "license": "Site content license pending",
          "source": "/logos/aptlantis-privacy-hero-logo.svg"
        },
        "sesm_version": "0.3.0"
      },
      "dimensions": {
        "width": "1448",
        "height": "1086",
        "viewBox": "0 0 1448 1086"
      },
      "roles": ["branding", "illustration"]
    },
    {
      "type": "asset",
      "asset_type": "svg",
      "slug": "aptlantis-studio-logo",
      "title": "Aptlantis Studio Logo",
      "source": {
        "format": "svg",
        "path": "/logos/aptlantis-studio-logo.svg",
        "publicUrl": "/logos/aptlantis-studio-logo.svg",
        "content_hash": "sha256:a49ee533cdbd6d57c3c16b9dc95c0607e856a128fc7d0cc2616051ed81fad5fb"
      },
      "sesm": {
        "accessibility": {
          "summary": "Aptlantis Studio Logo"
        },
        "asset": {
          "ecosystem": "Aptlantis Studio",
          "id": "aptlantis-studio-logo",
          "role": "logo",
          "tags": ["logo", "branding"],
          "title": "Aptlantis Studio Logo"
        },
        "provenance": {
          "author": "Aptlantis",
          "generated": false,
          "generated_at": "1784133488",
          "generator": {
            "language": "rust",
            "name": "aptlantis-svg-asset-registry",
            "version": "0.1.0"
          },
          "license": "Site content license pending",
          "source": "/logos/aptlantis-studio-logo.svg"
        },
        "sesm_version": "0.3.0"
      },
      "dimensions": {
        "width": "1254",
        "height": "1254",
        "viewBox": "0 0 1254 1254"
      },
      "roles": ["logo", "branding"]
    },
    {
      "type": "asset",
      "asset_type": "svg",
      "slug": "dnf-achivalplugin-logo",
      "title": "Dnf Achivalplugin Logo",
      "source": {
        "format": "svg",
        "path": "/logos/dnf-achivalplugin-logo.svg",
        "publicUrl": "/logos/dnf-achivalplugin-logo.svg",
        "content_hash": "sha256:a0d4b448c358f1a9a7c3f1e91afa0d0e0653d8688536925438d63b2b2459caa7"
      },
      "sesm": {
        "accessibility": {
          "summary": "Dnf Achivalplugin Logo"
        },
        "asset": {
          "ecosystem": "Aptlantis Studio",
          "id": "dnf-achivalplugin-logo",
          "role": "logo",
          "tags": ["logo", "branding"],
          "title": "Dnf Achivalplugin Logo"
        },
        "provenance": {
          "author": "Aptlantis",
          "generated": false,
          "generated_at": "1784133488",
          "generator": {
            "language": "rust",
            "name": "aptlantis-svg-asset-registry",
            "version": "0.1.0"
          },
          "license": "Site content license pending",
          "source": "/logos/dnf-achivalplugin-logo.svg"
        },
        "sesm_version": "0.3.0"
      },
      "dimensions": {
        "width": "1254",
        "height": "1254",
        "viewBox": "0 0 1254 1254"
      },
      "roles": ["logo", "branding"],
      "debug": {
        "imported_at": "1784132581",
        "imported_by": "aptlantis-services/svg-assets-scan"
      }
    },
    {
      "type": "asset",
      "asset_type": "svg",
      "slug": "dnf-archivehasher-logo",
      "title": "Dnf Archivehasher Logo",
      "source": {
        "format": "svg",
        "path": "/logos/dnf-archivehasher-logo.svg",
        "publicUrl": "/logos/dnf-archivehasher-logo.svg",
        "content_hash": "sha256:a0beb925775b2a1cba198a1da1584deaa0d5978b9767034976d045e994274c24"
      },
      "sesm": {
        "accessibility": {
          "summary": "Dnf Archivehasher Logo"
        },
        "asset": {
          "ecosystem": "Aptlantis Studio",
          "id": "dnf-archivehasher-logo",
          "role": "logo",
          "tags": ["logo", "branding"],
          "title": "Dnf Archivehasher Logo"
        },
        "provenance": {
          "author": "Aptlantis",
          "generated": false,
          "generated_at": "1784133488",
          "generator": {
            "language": "rust",
            "name": "aptlantis-svg-asset-registry",
            "version": "0.1.0"
          },
          "license": "Site content license pending",
          "source": "/logos/dnf-archivehasher-logo.svg"
        },
        "sesm_version": "0.3.0"
      },
      "dimensions": {
        "width": "1254",
        "height": "1254",
        "viewBox": "0 0 1254 1254"
      },
      "roles": ["logo", "branding"],
      "debug": {
        "imported_at": "1784132581",